1	龙卷风是怎么形成的?
1	龙卷风是怎么来的
1	龙卷风是如何形成的
1	龙卷风产生原理是什么?
1	龙卷风为什么会出现呢
2	怪物猎人世界怎么捕获怪物
2	怪物猎人世界捕获的具体过程
2	求《怪物猎人世界》捕获猎物方法
2	有没有怪物猎人世界捕获方法详细介绍
2	想知道在怪物猎人世界怎样捕获怪物
3	奶茶加盟需要多少费用？
3	开一个奶茶店成本多少钱
3	加盟一家奶茶店大概需要多少钱？
3	加盟奶茶店大概要投资多少钱
3	奶茶加盟店要多少钱一共下来
4	星巴克的哪种咖啡热量最低？
4	星巴克哪个喝了不容易胖
4	星巴克热量最低的饮料是什么
4	星巴克美食的热量
4	星巴克什么饮料热量最低
5	中秋一般送什么礼？
5	中秋节送什么礼物比较好？
5	中秋送礼送什么好
5	中秋节送什么好？
5	中秋除了月饼送什么礼物好
6	风热感冒吃什么
6	风热感冒吃什么食物好？
6	风热感冒多吃什么水果
6	风热感冒不能吃什么？
6	风热感冒吃什么消炎药
7	如何喂猫粮？
7	小猫该吃什么猫粮。怎么吃。
7	怎样正确喂猫粮和罐头
7	猫粮喂什么好
7	猫粮怎么泡软
8	动物性鲜奶油与植物性鲜奶油的区别
8	植物奶油好还是动物奶油好
8	做西点时用的植物淡奶油和动物淡奶油有啥区别？
8	淡奶油是植物奶油还是动物奶油
8	如何鉴别植物奶油和动物奶油
9	护肤品的顺序是先用乳液还是精华？
9	护肤品正确使用顺序是什么？
9	化妆水和乳液应该先用哪个？
9	化妆水、乳液、霜、隔离，先后顺序是怎样的？
9	化妆前都要擦些什么。先用什么
10	化妆水和爽肤水什么区别？有什么作用
10	化妆水是不是就是爽肤水?
10	爽肤水，化妆水和柔肤水的区别是什么？
10	化妆水和爽肤水一样吗
10	化妆水能不能当爽肤水用啊
11	达到什么条件就能使用住房公积金
11	到底住房公积金怎么用啊？
11	住房公积金怎么用最合适
11	什么时候可以用公积金
11	住房公积金到底是干什么用的？
12	海贼王草帽海贼团第11个伙伴究竟是谁
12	海贼王里的第十位伙伴和第十一位伙伴是谁
12	第十人确认之后，海贼王还会有第十一人吗
12	海贼王介绍11个新人的是哪集?
12	海贼王草帽海贼团会不会变成10个人？
13	什么洗发水有比较浓的香味
13	什么洗发露香味持久?
13	什么洗发水能让头发很香？
13	香味浓的洗发水对人体有危害吗？
13	洗发水有香味好吗
14	闪耀暖暖什么时候能玩
14	闪耀暖暖什么时候公测
14	闪耀暖暖什么时候出
14	闪耀暖暖公测完了吗？还有二测吗
14	闪耀暖暖游戏内测多长时间
15	恋与制作人结局是什么？
15	恋与制作人有多种结局吗？
15	恋与制作人白起结局是什么
15	恋与制作人周棋洛结局如何达成
15	恋与制作人四个男主目前的结局是什么？
16	叠纸公司开发了哪些游戏？
16	叠纸公司的游戏怎么样？
16	叠纸游戏有哪些比较好玩
16	叠纸游戏中哪款游戏比较好玩？
16	叠纸公司为什么那么火爆？
17	为什么戚风蛋糕长不起来
17	戚风蛋糕发不起来是什么原因？
17	戚风蛋糕长不高怎么回事
17	戚风蛋糕为什么会塌陷？
17	戚风蛋糕为什么会回缩
18	阴阳师SSR画符抽卡SSR爆率怎么提高
18	阴阳师怎么抽ssr几率高
18	《阴阳师》怎样抽卡SSR多呢？
18	阴阳师ssr抽卡时机如何判断
18	阴阳师ssr画符抽卡和运势有关系吗
19	外出旅游必带物品有哪些？
19	出去旅游需要带些什么东西？
19	出门旅行需要带那些常用物品？
19	出去旅游必带的东西有哪些？
19	旅行必须带上什么必需品？
20	一月初去上海学习，请问上海冬天都穿什么
20	上海冬天冷吗？穿什么衣服可以过冬？
20	上海的冬天穿什么好?
20	一月末去上海应该穿什么衣服，裤子，鞋
20	第一次在上海过冬天 请问上海冬天冷么 需不需要穿羽绒服
21	在下坂本 有何贵干 坂本全名叫什么？
21	动漫《在下坂本》，坂本 是姓还是名？
21	在下坂本里的大佬真实身份是什么
21	在下坂本是什么来头？这么强
21	在下坂本里坂本大佬的全名到底叫什么
22	森系一般都是怎么搭配
22	森系春装搭配有哪些
22	怎样搭配，驾驭森系的衣服？
22	森系裙搭配什么上衣
22	女生如何搭配出森系风格？
23	资生堂哪种系列适合油性皮肤的人使用？
23	皮肤油毛孔大有黑头适合用资生堂化妆品哪个系列
23	资生堂红腰子精华适合油性皮肤吗
23	油性痘痘肌用资生堂乳液哪款好用
23	毛孔粗大，油性皮肤用资生堂的哪些护肤品？
24	被猫抓伤怎么办
24	被猫抓伤会得狂犬病吗
24	被猫抓伤要打什么针吗
24	被猫猫抓伤，出血会怎样？猫爪有毒吗？
24	被家猫抓伤需要进行哪些处理
25	烤箱污垢如何清理干净
25	烤箱使用后每次都要清理吗
25	烤箱内的油垢怎么清洗
25	烤箱中的油渍如何清除
25	什么东西可以清洗烤箱里面得油垢
26	模拟人生4人物mod怎么加入游戏
26	模拟人生4人物MOD怎么用
26	模拟人生4人物mod放在哪
26	模拟人生四的人物mod放在哪个文件夹
26	模拟人生4放进MOD，为何不起作用？
27	为什么笔记本电脑连不上wifi
27	为什么笔记本连不上无线网
27	笔记本突然连不上无线网了？
27	笔记本电脑不能连接无线网了 怎么解决
27	笔记本无线网连不上什么原因
28	新手健身从什么方面开始？
28	新手健身，在家用器械和去健身房区别大吗
28	请问初学者如何健身
28	新手健身先练什么？
28	健身初学者买什么？
29	第一次租房应该注意什么
29	第一次租房，找中介要注意一些什么？
29	第一次租房要注意什么事项
29	租房子都需要注意什么，我是第一次准备去租房子
29	第一次租房，要注意哪些细节
30	如何做方便省时间的早餐
30	早上怎么解决早餐，既省时、省事、又营养健康！
30	早上可以做什么简单又省时的早餐
30	有什么简单省时的早餐
30	简单省时美味早餐怎么做
31	西安都有什么好玩的地方
31	西安有哪些好玩的地方？
31	西安什么地方好玩
31	西安到底好不好玩？
31	西安游玩比较经典的地方，需要几天？
32	古典音乐新手入门，首先要听哪些音乐家的哪些作品？
32	古典音乐入门，该选择怎么样的唱片听呢？
32	求古典音乐的入门歌曲
32	古典音乐入门必听基本曲目有哪些？
32	西方古典音乐入门听谁的比较好
33	跑男里胡辣汤游戏的规则是什么
33	跑男胡辣汤游戏怎么玩
33	跑男里五碗胡辣汤游戏怎么玩
33	《跑男》里“胡辣汤游戏”的规则是什么？
33	这期跑男胡辣汤的游戏到底怎么算的
34	奥迪标志的含义是什么？
34	奥迪的标志是什么意思
34	奥迪上的 这个是什么标志
34	奥迪标志的四个圈是什么意思？
34	奥迪标志为什么是四个圈
35	如何改变我的讨好型性格？
35	如何 走出 讨好型人格？
35	讨好型人格怎么改变
35	是讨好型人格怎么办
35	怎么解决自己的讨好型人格
36	上升星座、月亮星座、太阳星座分别是什么意思?
36	太阳，月亮，上升，到底哪个才是真正的自己
36	太阳,月亮和上升星座各代表什么意思?
36	星盘的太阳月亮上升星座都是什么意思？
36	上升与月亮太阳哪个影响大
37	厨房里必备的锅有哪几种？
37	家里厨房一般要有几口锅，都是什么锅？
37	新家里 厨房都需要买那些锅具 都有什么用
37	在厨房里使用的最多的锅是哪一种？
37	厨房锅具买什么好?
38	空调开多少度合适？
38	空调一般开多少度适宜?
38	空调温度开多少最舒适
38	室内空调多少度合适
38	夏天空调开多少度合适
39	家用空调什么牌子好
39	家用空调什么牌子质量好
39	家用空调哪个品牌最好
39	家用空调选什么牌子好
39	家用空调什么品牌好
40	chrome 怎么添加应用扩展
40	如何添加google扩展程序？
40	如何添加扩展程序到chrome
40	谷歌浏览器扩展插件如何设置使用?
40	谷歌浏览器的扩展程序怎么用？