120	猫和狗一起养会打架吗？
120	猫和狗一起养，结果会是什么样？
120	小猫和小狗放在一起养合适吗
120	怎么一起养猫与狗
120	什么猫、什么狗最适合一起养？
121	彩色衣服染色怎么洗掉
121	衣服被染色，怎么洗能彻底洗回原样啊？
121	衣服被褪色的衣服染色了，怎样才能洗干净。
121	我洗的衣服晾干后染色了，该怎么处理？
121	衣服被染色用什么东西洗才能洗干净？
122	甲醛吸多了会掉头发吗
122	吸甲醛会不会导致掉头发
122	甲醛会不会使人掉头发
122	屋内甲醛太多会引起掉发吗?
122	甲醛有可能导致脱发吗
123	30多了学什么好
123	30+的年龄，还可以学些什么？
123	30岁，还能学什么技术呢？
123	30岁学什么有前途
123	30岁还能学什么东西？
124	为什么我头发很油?
124	头发总是很油是怎么回事？
124	头发很容易就出油,是什么原因引起的呢?
124	头发突然变得很油了怎么办?
124	为什么每天起床后，头发会很油
124	头发油是什么造成的
125	突然好几天失眠怎么办
125	严重失眠已经好几天该怎么办？
125	连续失眠好几天是怎么回事
125	失眠好几天为什么不困
125	失眠怎么办，已经有好几天了
126	黄瓜蘸酱的酱怎么做
126	黄瓜沾酱最好用什么酱？甜面酱还是黄豆酱？
126	黄瓜蘸酱应该使用什么酱
126	黄瓜蘸酱的酱是什么酱
126	黄瓜平时沾的的酱是什么酱
127	女孩子生病了该如何表现关心
127	女生生病了到底怎样才算关心
127	一个女孩子生病了，怎么很好的安慰关心
127	一个女孩跟我说她生病了 我该怎么办
127	我喜欢的女生生病了，我该怎么关心她？
128	北京有几个大的花卉市场?在哪儿?
128	北京最大的花卉市场是哪个？在哪里？
128	在北京的什么地方有花卉市场??
128	北京有哪些花卉市场?
128	北京比较知名的花市有哪些
128	北京最大的鲜花批发市场在哪里？
129	面试穿什么衣服好？
129	去参加面试穿什么衣服最合适？
129	面试穿什么服装比较得体？
129	面试穿什么样的衣服好一点？
129	面试时穿什么衣服好，必须得穿职业装吗
130	润唇膏和润唇啫喱的有什么区别啊？
130	护唇膏跟护唇啫喱有什么区别？
130	唇膏、唇蜜、润唇啫喱在效果上有何不同？
130	润唇膏好，还是润唇啫喱好呢？
130	润唇啫喱和润唇膏 哪个好?
131	如何评价石原里美的演技
131	石原里美演技好吗
131	石原里美的演技怎么样
131	日本女星里石原算什么水平的？
132	想买家用天文望远镜，什么牌子最好？
132	天文望远镜买什么牌子的好呢？
132	中国天文望远镜牌子排名哪个好？
132	什么牌子的天文望远镜最好？
132	选择天文望远镜，什么品牌好？
133	双筒望远镜如何选择？
133	如何选购双筒望远镜？
133	如何选购适合自己的双筒望远镜
133	有哪些出色的双筒望远镜推荐购买？
133	怎样选购双筒望远镜？
134	自认为比较擅长数学物理，学什么专业好？
134	擅长数学、物理报考大学什么专业最好？
134	喜欢数学和物理，大学应该选择什么专业
134	数学物理好的人学什么专业
134	擅长物理与数学可以选择什么专业
135	选择哪种小功率开关电源芯片好一些
135	现在比较好的低功率电源芯片有哪些
135	小功率的电源芯片适用小家电有哪些可以推荐的
135	关于小功率开关电源芯片的选择
135	求助，小功率电源芯片选哪个比较好
136	高中物理一对一辅导多少钱
136	高中物理辅导班一对一辅导收费标准大概是多少
136	现在高三物理老师一对一辅导怎么收费
136	高中物理一对一在线辅导价格大概多少钱一节课？
136	高中物理家教一对一多少钱？
137	什么样的细胞爬片好用
137	哪个公司的细胞爬片好用呢？
137	细胞爬片哪种好用？
137	细胞爬片哪个牌子用的人多？
137	细胞爬片哪家好?
138	染色体异常会带来哪些影响
138	染色体异常有多大影响
138	染色体异常会出现哪些情况
138	染色体异常携带者自身有什么影响
138	染色体异常会带来哪些疾病
139	哪些植物具有神奇之处
139	大自然中哪些植物有什么奇异现象
139	你知道哪些植物的奇妙之处？
139	具有神奇之处的植物有哪些？
139	奇妙的植物有哪些
140	那些动物具有自我保护的功能
140	小动物有哪些自我保护的办法
140	有什么动物有自我保护功能
140	什么动物或者植物有自我保护的功能?方法又是什么?
140	那些动物具有自我保护的本领?
141	为什么蜂蜜不会坏?
141	蜂蜜为什么久放不坏？
141	蜂蜜放久了会不会变质
141	蜂蜜放时间长了会坏吗?
141	蜂蜜放久了能坏吗？
142	怎么鉴别买来的蜂蜜是真是假
142	怎么鉴定蜂蜜的真假
142	购买蜂蜜时怎样辨别蜂蜜的真假
142	怎么用最简单的方法辨别蜂蜜的真假？
142	如何分辨蜂蜜真假？
143	蜂蜜分为哪几种？
143	蜂蜜的类型有哪几种
143	蜂蜜都有哪些种类？
143	蜂蜜有哪几种
143	蜂蜜分几种？
144	吃玉米可以减肥吗
144	天天吃玉米能减肥吗？
144	经常吃玉米能减肥吗，有没有用啊
144	每天都吃玉米可以减肥吗
144	整天只吃玉米能减肥吗
145	芒果汁哪个牌子的好？
145	什么牌子芒果汁好喝？
145	有哪个牌子芒果汁好喝的？
145	芒果汁谁家的好喝啊?
145	比较好喝的芒果汁品牌有哪些？
146	种植多肉的好处有哪些
146	养多肉植物有什么好处
146	多肉植物有什么好处
146	多肉植物的好处有哪些？
146	种多肉有什么好处
147	怎样腌制芹菜
147	芹菜怎么腌制
147	芹菜生腌，应该怎么腌制
147	腌制芹菜的方法有哪些
147	芹菜的腌制方法有哪些？
148	法国签证怎么办理
148	申请办理法国签证是什么流程，要准备哪些资料？
148	去法国签证要多久?怎么办?
148	如何办理法国自由行（个人旅游）签证
148	去法国旅游签证要怎么办？
149	开个奶茶店需要哪些东西
149	开个奶茶店需要哪些设备，和具体哪些东西。
149	开一个奶茶店需要做什么。详细点。
149	开一家奶茶店都需要什么设备？越详细越好
149	开家奶茶店都需要准备哪些东西
150	如何把网店做好？
150	如何把一个网店经营好？
150	如何开好一个网店？
150	怎样把网店做好呢？
150	怎样才能做好一家网店？
151	用什么工具压缩视频？
151	什么软件可以把视频压缩变小啊？
151	视频压缩用什么软件
151	视频压缩软件哪个比较好用
151	用什么软件压缩视频最好?
152	老板刻意扣员工工资怎么办？
152	老板克扣员工工资
152	老板可以随意扣员工工资吗
152	老板扣员工工钱，怎么办？
152	老板乱扣工资怎么办？
153	大学生基本医疗保险给报销么
153	在校大学生医保报销
153	大学生的医疗保险报销范围有哪些，比例是多少
153	在校大学生看病能报销吗
153	大学生医保报销范围是什么？
154	什么牌子的车牌 识别系统好用
154	车牌识别系统品牌有哪些
154	车牌识别系统哪家的识别率高？识别的车牌种类多？
154	目前，车牌识别系统什么品牌做的比较好？？？
154	求识别率最高的车牌识别系统
155	中秋节有什么说法么
155	关于中秋的故事有哪些
155	中秋节的传说、来历、习俗
155	中秋节的由来，有什么习俗？
155	中秋节节有什么来历
156	中学生过生日去哪里好
156	中学生生日聚会去哪里合适
156	过生日在哪里过好? 急!!! 适合中学生的....
156	过生日请同学去哪里玩好
156	过生日去哪里玩好 我们是中学生太贵的玩不起 ktv去过了不去酒吧 能去哪里
157	中秋节除了吃月饼，还有什么
157	中秋节除了吃月饼还会干什么？
157	中秋节除了吃月饼还有什么习俗？
157	中秋节人们除了吃月饼,赏月亮还做什么?
157	中秋节除了赏月，吃月饼，还可以做什么好玩的事情
158	气功是真的吗?
158	气功真的存在吗？
158	这个世界上真的有气功吗？
158	气功培训是真的还是假的
158	气功的自然功是真的吗
159	咏春拳的特点
159	咏春拳有哪些特点
159	咏春拳学的主要特点
159	咏春拳的特点是什么？学习咏春拳有什么用？
159	咏春拳的优势特点
160	“驴打滚”为什么叫驴打滚
160	北京小吃驴打滚的来历
160	北京小吃“驴打滚”为什么叫“驴打滚”？
160	有一种小吃为什么叫“驴打滚”？
160	驴打滚为什么叫这个名字
161	天为什么是蓝的
161	为什么天是蓝的
161	天空为什么是蓝色的，什么原理
161	天空的颜色为什么是蓝色的？
161	天为什么是蓝的不是白的
162	世界上真有鬼吗？
162	鬼真的存在吗？
162	世界上到底有没有鬼?
162	现实中真的是有鬼吗？
162	有鬼吗，人死后会变成鬼吗？
163	中国有哪些地方有未解之谜
163	寻找中国科学十大未解之谜
163	中国历史上还有哪些未解之谜
163	中国古代十大未解之谜
163	中国十大未解之谜有哪些
164	北京故宫门票多少？
164	现在去北京故宫，门票是多少钱
164	故宫有导游吗，价钱多少门票价格
164	北京故宫一日游多少钱
164	去故宫要提前一天买票吗，多少钱
165	冬天到了,大雁为什么南飞了?
165	为什么大雁冬天要飞去南方
165	大雁生活在什么地方?冬天为何要飞向南方夏天又飞回去?
165	大雁冬天的时候为什么要飞到南方去
165	大雁为什么每年秋天都要飞到南方去过冬？
166	个人所得税怎么计算
166	目前我国的个人所得税是如何计算的？
166	现在个税怎么计算
166	企业个人所得税怎么计算
166	工资里的个人所得税是怎么算的
167	有什么好看的电视剧推荐一下
167	推荐一些好看的大陆电视剧！
167	推荐几部好看的大型史诗电视剧
167	有哪些好看的，评分高的国产电视剧推荐
167	推荐几部好看的历史电视剧
168	怎么开阴阳眼
168	普通人可以开阴阳眼吗？怎么开
168	阴阳眼是什么？怎么开？
168	开阴阳眼的方法
168	怎样打开自己的阴阳眼？
169	从地球到火星要飞多久
169	人类从地球到火星，飞船大约要飞多久
169	从地球到火星有多远?火箭要飞多久?
169	地球到火星要多长时间
169	从地球到火星有多远？要多久能到？（以光速）
170	月亮上有没有外星人呢？
170	月球上到底有没有外星人？
170	请问月球上有外星人吗
170	月球上真的有外星人吗？
170	月球里面真的有外星人吗
171	人有投胎转世吗？
171	人投胎转世是真的吗？
171	人真的有转世轮回吗?
171	世界上真的有人可以转世吗
171	人会转世投胎吗？
172	鸿茅药酒的效果真的那么神奇吗？
172	请问鸿茅药酒真的有那么神奇吗？
172	鸿茅药酒是骗人的吗
172	鸿茅药酒真的有效吗
172	鸿茅药酒到底好不好
173	艾灸能有效祛湿吗 需要坚持多久
173	艾灸可以去湿气吗
173	艾灸多久可以去除湿气
173	艾灸可以去除湿气吗？
173	艾灸能治湿气吗
174	体内湿气重怎么调理好
174	体内湿气重的人，如何进行日常调理？
174	体内湿气重怎么办，平时要注意什么
174	体内湿气重要怎么调理好些
174	身体湿气重怎么调理对身体好
175	怎样辨别阿胶的真假?
175	怎样区别阿胶真假？
175	阿胶怎么分真假？
175	古代怎么辨别阿胶真假？
175	如何辨别阿胶的真伪
176	有哪些偏方可以止咳
176	简单有效的止咳偏方有哪些
176	止咳最快的偏方
176	有什么快速止咳的方法吗？
176	快速有效止咳的方法
177	给古曼供奉食物必须要上香么
177	古曼供东西吃的时候要上香吗
177	古曼童一般几天一上香
177	如何供奉古曼童
177	古曼童供奉什么
178	肌底液适合什么年龄的人用？
178	肌底液什么年龄段使用
178	求科普：肌底液适合哪个年龄段用？
178	肌底液适合哪个年龄段用？我现在25岁用是不是太早了？
178	肌底液多大年龄开始用
179	巴洛克时期的服装特点
179	请问什么是巴洛克风格？其服装特点？
179	巴洛克风格服装的典型代表是什么
179	巴洛克风格的服装需要具备哪些元素？
179	巴洛克服装风格是什么样？
180	黄山区在安徽哪个地方
180	黄山在安徽的什么地方？
180	请问安徽黄山属于安徽哪个地级市？
180	黄山的具体位置在安徽的哪儿？
180	安徽 黄山是在哪个市
181	被狗咬会怎么办？
181	如果被狗咬了怎么办
181	被狗咬的处理方法
181	被狗咬了，怎么办？最少要打几针？
181	被狗咬后要打针吗？
182	兔子摔下来磕掉了一半的牙齿，还能长起来吗
182	兔子的牙摔断了会不会再长
182	兔子前牙掉了能不能再长出来
182	我家的小兔子把门牙磕歪了，但是没全掉，还能再长吗
182	兔子牙掉了还能长吗
183	秋天盛开的花有哪些
183	秋天盛开的花有什么花
183	什么花是秋天开的
183	有什么花是秋天开的？？
183	秋天开的野花有哪些花
184	落地大花瓶摆放风水怎么摆
184	客厅摆放落地大花瓶有什么讲究
184	客厅落地大花瓶摆设风水有哪些讲究
184	家里客厅放落地大花瓶应放哪个位子? 有什么说法
184	客厅落地大花瓶的摆放风水禁忌有哪些
185	风湿早期症状都有哪些
185	风湿有什么症状
185	风湿病的前兆有哪些表现
185	风湿病有哪些症状呢
185	风湿,类风湿都有什么症状,是什么原因引起的啊
186	有什么办法可以缓解风湿
186	怎么缓解风湿病的疼痛?
186	风湿病怎样缓解
186	有风湿病，膝盖疼痛怎么缓解
186	风湿关节炎 如何缓解关节疼痛
187	家中养花风水禁忌有哪些？
187	家里养花的风水方面有哪些讲究
187	住宅养花风水禁忌都有哪些
187	家中养花的禁忌风水有哪些需要注意的
187	家中养花风水禁忌你知道多少
188	老猫与新来的幼猫为什么不能和睦相处
188	家里新来了一只小猫 但老猫不高兴怎么办
188	怎么让老猫和新猫友好相处啊？
188	来了新猫，老猫生气了，怎么办
188	新猫与老猫之间总是打架怎么办
189	枸杞子可以和板栗一起泡酒吗
189	枸杞泡酒里可以再加些栗子（也就是板栗）吗？
189	枸杞和板栗一起能泡酒吗
189	栗子和枸杞可以同时泡酒吗
189	板栗和枸杞能一起泡酒吗？有什么好处？
190	狗得了细小，用什么药治疗？
190	狗狗得细小该吃什么药？
190	我的狗得了细小 吃什么药最有效啊
190	狗狗得了细小怎么样治疗
190	狗狗患细小病毒用什么药
191	在宠物店买到假狗怎么办
191	买到假狗怎么办可以投诉么
191	如果在宠物店买到不纯的狗狗怎办？
191	买到了假的宠物狗怎么办
191	在微信上的宠物店买到假狗 怎么维权啊？！
192	电力猫什么品牌好?
192	电力猫哪种品牌好？
192	电力猫什么牌子的好？
192	请高手推荐下电力猫，哪个牌子的电力猫好？
192	哪个牌子的电力猫最好？
193	刚买的鹩哥不吃开元颗粒饲料怎么办
193	鹩哥不吃饲料怎么办?
193	鹩哥不吃吃食料怎么办？
193	鹩哥不吃干饲料怎么办?
193	鹩哥突然不怎么吃东西了怎么办?
194	鲐鲅鱼要怎么才好吃
194	鲐鲅鱼怎么做如何做好吃
194	怎么做鲐鲅鱼好吃
194	如何做鲐鲅鱼好吃？
194	求鲐鲅鱼的做法，怎么做好吃？
195	哪些犬品种大，凶又听话的
195	什么狗很凶猛，而且还比较听话的
195	什么狗最凶？最听话？
195	有哪些大型凶猛犬推荐，要好养的，且听话！
195	有什么狗既听话又凶？
196	海葡萄怎么吃
196	海葡萄可以不可以生吃
196	海葡萄不能与什么同吃
196	胃不好可以吃海葡萄吗
196	新鲜的海葡萄能直接吃吗