1	龙卷风是怎么形成的?
1	龙卷风是怎么来的
1	龙卷风是如何形成的
1	龙卷风产生原理是什么?
1	龙卷风为什么会出现呢
2	怪物猎人世界怎么捕获怪物
2	怪物猎人世界捕获的具体过程
2	求《怪物猎人世界》捕获猎物方法
2	有没有怪物猎人世界捕获方法详细介绍
2	想知道在怪物猎人世界怎样捕获怪物
3	奶茶加盟需要多少费用？
3	开一个奶茶店成本多少钱
3	加盟一家奶茶店大概需要多少钱？
3	加盟奶茶店大概要投资多少钱
3	奶茶加盟店要多少钱一共下来
4	星巴克的哪种咖啡热量最低？
4	星巴克哪个喝了不容易胖
4	星巴克热量最低的饮料是什么
4	星巴克美食的热量
4	星巴克什么饮料热量最低
5	中秋一般送什么礼？
5	中秋节送什么礼物比较好？
5	中秋送礼送什么好
5	中秋节送什么好？
5	中秋除了月饼送什么礼物好
6	风热感冒吃什么
6	风热感冒吃什么食物好？
6	风热感冒多吃什么水果
6	风热感冒不能吃什么？
6	风热感冒吃什么消炎药
7	如何喂猫粮？
7	小猫该吃什么猫粮。怎么吃。
7	怎样正确喂猫粮和罐头
7	猫粮喂什么好
7	猫粮怎么泡软
8	动物性鲜奶油与植物性鲜奶油的区别
8	植物奶油好还是动物奶油好
8	做西点时用的植物淡奶油和动物淡奶油有啥区别？
8	淡奶油是植物奶油还是动物奶油
8	如何鉴别植物奶油和动物奶油
9	护肤品的顺序是先用乳液还是精华？
9	护肤品正确使用顺序是什么？
9	化妆水和乳液应该先用哪个？
9	化妆水、乳液、霜、隔离，先后顺序是怎样的？
9	化妆前都要擦些什么。先用什么
10	化妆水和爽肤水什么区别？有什么作用
10	化妆水是不是就是爽肤水?
10	爽肤水，化妆水和柔肤水的区别是什么？
10	化妆水和爽肤水一样吗
10	化妆水能不能当爽肤水用啊
11	达到什么条件就能使用住房公积金
11	到底住房公积金怎么用啊？
11	住房公积金怎么用最合适
11	什么时候可以用公积金
11	住房公积金到底是干什么用的？
12	海贼王草帽海贼团第11个伙伴究竟是谁
12	海贼王里的第十位伙伴和第十一位伙伴是谁
12	第十人确认之后，海贼王还会有第十一人吗
12	海贼王介绍11个新人的是哪集?
12	海贼王草帽海贼团会不会变成10个人？
13	什么洗发水有比较浓的香味
13	什么洗发露香味持久?
13	什么洗发水能让头发很香？
13	香味浓的洗发水对人体有危害吗？
13	洗发水有香味好吗
14	闪耀暖暖什么时候能玩
14	闪耀暖暖什么时候公测
14	闪耀暖暖什么时候出
14	闪耀暖暖公测完了吗？还有二测吗
14	闪耀暖暖游戏内测多长时间
15	恋与制作人结局是什么？
15	恋与制作人有多种结局吗？
15	恋与制作人白起结局是什么
15	恋与制作人周棋洛结局如何达成
15	恋与制作人四个男主目前的结局是什么？
16	叠纸公司开发了哪些游戏？
16	叠纸公司的游戏怎么样？
16	叠纸游戏有哪些比较好玩
16	叠纸游戏中哪款游戏比较好玩？
16	叠纸公司为什么那么火爆？
17	为什么戚风蛋糕长不起来
17	戚风蛋糕发不起来是什么原因？
17	戚风蛋糕长不高怎么回事
17	戚风蛋糕为什么会塌陷？
17	戚风蛋糕为什么会回缩
18	阴阳师SSR画符抽卡SSR爆率怎么提高
18	阴阳师怎么抽ssr几率高
18	《阴阳师》怎样抽卡SSR多呢？
18	阴阳师ssr抽卡时机如何判断
18	阴阳师ssr画符抽卡和运势有关系吗
19	外出旅游必带物品有哪些？
19	出去旅游需要带些什么东西？
19	出门旅行需要带那些常用物品？
19	出去旅游必带的东西有哪些？
19	旅行必须带上什么必需品？
20	一月初去上海学习，请问上海冬天都穿什么
20	上海冬天冷吗？穿什么衣服可以过冬？
20	上海的冬天穿什么好?
20	一月末去上海应该穿什么衣服，裤子，鞋
20	第一次在上海过冬天 请问上海冬天冷么 需不需要穿羽绒服
21	在下坂本 有何贵干 坂本全名叫什么？
21	动漫《在下坂本》，坂本 是姓还是名？
21	在下坂本里的大佬真实身份是什么
21	在下坂本是什么来头？这么强
21	在下坂本里坂本大佬的全名到底叫什么
22	森系一般都是怎么搭配
22	森系春装搭配有哪些
22	怎样搭配，驾驭森系的衣服？
22	森系裙搭配什么上衣
22	女生如何搭配出森系风格？
23	资生堂哪种系列适合油性皮肤的人使用？
23	皮肤油毛孔大有黑头适合用资生堂化妆品哪个系列
23	资生堂红腰子精华适合油性皮肤吗
23	油性痘痘肌用资生堂乳液哪款好用
23	毛孔粗大，油性皮肤用资生堂的哪些护肤品？
24	被猫抓伤怎么办
24	被猫抓伤会得狂犬病吗
24	被猫抓伤要打什么针吗
24	被猫猫抓伤，出血会怎样？猫爪有毒吗？
24	被家猫抓伤需要进行哪些处理
25	烤箱污垢如何清理干净
25	烤箱使用后每次都要清理吗
25	烤箱内的油垢怎么清洗
25	烤箱中的油渍如何清除
25	什么东西可以清洗烤箱里面得油垢
26	模拟人生4人物mod怎么加入游戏
26	模拟人生4人物MOD怎么用
26	模拟人生4人物mod放在哪
26	模拟人生四的人物mod放在哪个文件夹
26	模拟人生4放进MOD，为何不起作用？
27	为什么笔记本电脑连不上wifi
27	为什么笔记本连不上无线网
27	笔记本突然连不上无线网了？
27	笔记本电脑不能连接无线网了 怎么解决
27	笔记本无线网连不上什么原因
28	新手健身从什么方面开始？
28	新手健身，在家用器械和去健身房区别大吗
28	请问初学者如何健身
28	新手健身先练什么？
28	健身初学者买什么？
29	第一次租房应该注意什么
29	第一次租房，找中介要注意一些什么？
29	第一次租房要注意什么事项
29	租房子都需要注意什么，我是第一次准备去租房子
29	第一次租房，要注意哪些细节
30	如何做方便省时间的早餐
30	早上怎么解决早餐，既省时、省事、又营养健康！
30	早上可以做什么简单又省时的早餐
30	有什么简单省时的早餐
30	简单省时美味早餐怎么做
31	西安都有什么好玩的地方
31	西安有哪些好玩的地方？
31	西安什么地方好玩
31	西安到底好不好玩？
31	西安游玩比较经典的地方，需要几天？
32	古典音乐新手入门，首先要听哪些音乐家的哪些作品？
32	古典音乐入门，该选择怎么样的唱片听呢？
32	求古典音乐的入门歌曲
32	古典音乐入门必听基本曲目有哪些？
32	西方古典音乐入门听谁的比较好
33	跑男里胡辣汤游戏的规则是什么
33	跑男胡辣汤游戏怎么玩
33	跑男里五碗胡辣汤游戏怎么玩
33	《跑男》里“胡辣汤游戏”的规则是什么？
33	这期跑男胡辣汤的游戏到底怎么算的
34	奥迪标志的含义是什么？
34	奥迪的标志是什么意思
34	奥迪上的 这个是什么标志
34	奥迪标志的四个圈是什么意思？
34	奥迪标志为什么是四个圈
35	如何改变我的讨好型性格？
35	如何 走出 讨好型人格？
35	讨好型人格怎么改变
35	是讨好型人格怎么办
35	怎么解决自己的讨好型人格
36	上升星座、月亮星座、太阳星座分别是什么意思?
36	太阳，月亮，上升，到底哪个才是真正的自己
36	太阳,月亮和上升星座各代表什么意思?
36	星盘的太阳月亮上升星座都是什么意思？
36	上升与月亮太阳哪个影响大
37	厨房里必备的锅有哪几种？
37	家里厨房一般要有几口锅，都是什么锅？
37	新家里 厨房都需要买那些锅具 都有什么用
37	在厨房里使用的最多的锅是哪一种？
37	厨房锅具买什么好?
38	空调开多少度合适？
38	空调一般开多少度适宜?
38	空调温度开多少最舒适
38	室内空调多少度合适
38	夏天空调开多少度合适
39	家用空调什么牌子好
39	家用空调什么牌子质量好
39	家用空调哪个品牌最好
39	家用空调选什么牌子好
39	家用空调什么品牌好
40	chrome 怎么添加应用扩展
40	如何添加google扩展程序？
40	如何添加扩展程序到chrome
40	谷歌浏览器扩展插件如何设置使用?
40	谷歌浏览器的扩展程序怎么用？
41	北京通州区哪有比较好的学乐器的地方？
41	我在北京通州北苑，想在附近学吉他，初级要多少钱
41	北京市通州区 在哪里学笛子
41	北京通州哪里有学乐器的？最好在新华大街附近
41	北京市通州区萨克斯学习哪里有，大概多少钱
41	北京通州那里有学古筝的
42	美国个人旅游签证好签吗？
42	美国旅游签证好办吗?
42	去美国旅游签证好办吗
42	去美国签证有哪几种？
42	去美国旅游签证费是多少
43	两个月宝宝需要补钙吗
43	新生儿多大适合补钙和锌
43	七个月大的宝宝需要补钙吗
43	孩子需要长期补钙吗？
43	多大的小孩子需要开始补钙？
43	所有婴儿都需要补钙吗
44	夏天食欲不振为什么？
44	夏天食欲不振怎么办？？？
44	为什么夏天没有胃口?
44	夏天食欲不振应该吃点什么缓解一下？
44	夏天人为什么没食欲
44	夏天食欲不振的原因有哪些
45	怎样处理好婆媳关系
45	怎样处理婆媳关系？
45	婆媳关系怎么处理好
45	为什么结婚后、一般的婆媳关系都不好呢
45	为什么婆媳关系处不好
45	婆媳关系不好怎么办？
46	遇到家庭暴力怎么办?
46	家庭暴力发生时该怎么办
46	家庭暴力有哪几种分类
46	造成家庭暴力的主要原因是什么?
46	家庭暴力该如何处理？
47	小学生手抄报如何办
47	二年级小学生手抄报适合用什么内容
47	小学生的手抄报有哪些
47	小学生手抄报怎样画
47	适合小学生黑板报的主题有哪些
48	气球培训学校做的最好的是哪一家？
48	请问气球培训哪里好？
48	国内比较好的气球培训班有哪些？
48	哪里有北京魔术气球培训？
48	哪里的气球培训做的专业？
48	国内气球培训最牛的是什么地方？
49	求询问，暑假快递依然会送到学校吗
49	放假了学校快递还开吗
49	暑假里学校里没有快递了吗
49	暑假把快递寄到学校怎么解
49	学校要放暑假了，EMS快递怎么办 ?
50	微信朋友圈被屏蔽了，怎么破解?
50	朋友圈被人屏蔽了，我应该怎么做？
50	被别人屏蔽朋友圈后怎么才能看得到
50	如何知道自己朋友圈是否被关注的某人屏蔽了
50	怎么查看朋友圈是否被屏蔽
51	天津特产小吃有哪些？
51	天津好吃的小吃有哪些
51	天津最有名的小吃是什么？
51	天津的小吃有哪些好的
51	天津最有名的小吃有哪几种？
51	天津有什么著名小吃？
52	如何与网红谈合作？
52	怎么样才能联系网红合作
52	有没有靠谱的网红合作方式？
52	网红合作哪个公司好
52	怎样和网红进行发布合作？
53	为什么tfboys这么红？
53	tfboys是怎么红的？
53	tfboys是怎么火的？
53	TFboys是怎么出名的啊。
53	tfboys是怎么火起来的？哪一年火的
53	tfboys 都是怎么出名的？怎么被公司签下的？
53	tfboys 长的那么丑为什么会火
54	jackson王嘉尔参加的综艺有哪些?
54	王嘉尔参加过哪些综艺节目？
54	王嘉尔最近的综艺节目，除了生活相对论还有个是什么？
54	王嘉尔参加过的中国综艺节目
54	王嘉尔今年上了什么综艺？包括网综
54	王嘉尔的最新综艺有哪些？？
55	夏目友人帐四季的主题曲分别是什么
55	夏目友人帐第2季的片头曲名字是什么
55	夏目友人帐第五季的片头曲和片尾曲分别叫啥
55	夏目友人帐第四季的片尾曲叫什么？
55	夏目友人帐第一季片尾曲什么名字，超喜欢啊
56	有没有好看的吸血鬼美剧？
56	有没有类似于“吸血鬼日记”的美剧？
56	吸血鬼题材的美剧 都有什么？
56	有没有关于吸血鬼的美剧推荐
56	关于吸血鬼的美剧都有哪些好看的？
57	有关吸血鬼的美剧或者电影都有哪些，名称是什么？
58	《旋风少女》中若白为什么要动手术
58	旋风少女2中若白到底死了没有
58	旋风少女若白最后结局怎样 戚百草到底最后和谁在一起
58	旋风少女之中若白是怎么死的?
58	若白得了什么病 旋风少女中若白死了吗
59	2018年哪些人真正犯太岁？
59	2018年犯太岁的属相有什么？
59	2018年，哪个生肖容易犯太岁？
59	2018年犯太岁的生肖有哪些
59	2018年犯太岁的生肖该如何化解？
60	漫威超级英雄系列应该按什么顺序看
60	漫威怎么按顺序看
60	漫威电影正确观看顺序是啥
60	看漫威电影时要按顺序看吗
60	漫威的美剧观看顺序，有顺序吗？（不包括电影）
60	漫威的几部电影，按时间顺序怎么排
61	为什么说王思聪有钱？
61	王思聪到底有多少钱？
61	王思聪的钱是怎么来的？
61	王思聪家爹是做什么的，为什么那么有钱
61	王思聪和马云谁更有钱
62	范丞丞到底是不是范冰冰和洪金宝的私生子？？？
62	范丞丞是不是范冰冰的私生子？
62	范丞丞究竟是不是范冰冰和洪金宝的私生子？
62	范丞丞到底是谁的孩子？
62	范丞丞和范冰冰到底什么关系
63	私生饭是什么意思？
63	什么是私生饭
63	所谓的 团饭 、私生饭、唯饭 指的是什么
63	在娱乐圈“私生饭”是什么意思？
63	什么是私生
64	怎样和天蝎座的人相处?
64	怎么和天蝎男相处
64	如何和天蝎座男生相处？
64	如何与天蝎座男友相处
64	怎样与天蝎座的情人相处
64	为什么天蝎座难以相处
65	运气一直不好怎么办
65	总是感觉自己运气没有别人好，怎么办？
65	人的运气不好了该怎么做
65	为什么有的人运气那么好我却总倒霉
65	为什么有的人运气就是好.而有的人运气就是背？
65	人真的是讲运气的吗？有什么办法可以让自己运气好？
66	星座性格到底准不准的，有根据吗
66	星座分析人性格准确吗?
66	星座性格说的准不准呀？
66	星座运势准确么 可信吗
66	星座到底可信吗。准不准？
67	瓷器值钱的有哪些，还是所有的瓷器都值钱呢？
67	哪些古瓷器最值钱？
67	什么朝代瓷器最贵
67	世界上最值钱的瓷器是什么样的
67	什么瓷器最值钱
68	玉和翡翠有什么区别吗
68	翡翠和玉的区别？如何鉴别？
68	翡翠和玉有什么区别？戴翡翠好还是玉好？
68	翡翠和玉的区别在哪里
68	怎么区分翡翠和玉
69	学电子竞技的前景好吗？
69	电竞专业好找工作吗、发展前景好吗？
69	打电竞有前途吗
69	电竞的前景好吗？
69	电子竞技这个专业怎么样？好不好就业？
69	电子竞技行业有前景么
70	如何成为声优
70	怎样成为一名声优？
70	在中国如何成为一个声优
70	我想成为声优（在中国）平时要怎么练习？
70	如何当声优
70	成为声优，要有什么条件？
70	要怎样成为声优
71	攻受主要分哪几种？
71	攻受种类有多少？
71	攻受类型有哪些
71	攻受分成哪几种
71	攻受类型都有什么
72	全职高手人物关系这么混乱啊？叶秋到底喜不喜欢沐橙？
72	苏沐橙是叶修女朋友吗
72	全职高手中叶修与苏沐橙的关系是什么？
72	叶修最后跟苏沐橙在一起了吗
72	叶修和苏沐橙俩人什么关系？
73	网易云音乐的均衡器和音效怎么调才能听的时候更有感觉
73	网易云音乐怎么找不到均衡器？在哪里设置？
73	网易云音乐均衡器怎么调能达到最佳效果？
73	手机版的网易云音乐均衡器设置在哪里
73	为什么安装网易云音乐没有音效均衡器
74	顾漫作品有哪些
74	顾漫哪些小说改编成了电视剧
74	顾漫的最新作品是什么？
74	顾漫所有小说中哪部最好看
74	顾漫的小说有哪些
75	暗杀教室杀老师最后死了么
75	杀老师的真面目是什么
75	【暗杀教室】杀老师到最后会死吗
75	暗杀教室最后为什么一定要杀掉杀老师
75	暗杀教室的杀老师最后是怎么死的
76	运行程序的时候出现C++错误怎么办
76	c++为什么运行错误？？？
76	为什么编译正确的c++程序在运行时会停止工作
76	c++执行 link.exe 时出错.怎么回事呀？
76	为什么显示C++运行出错啊？
77	手机版腾讯视频怎么赠送影片给他人看？
77	手机版腾讯视频怎么赠送影片？
77	腾讯视频会员怎么发链接给别人免费看
77	腾讯视频怎样把用券看的视频传到别人那里去
77	腾讯视频会员怎么可以分享给别人
78	网络受限是什么原因？
78	为什么总是网络连接受限？
78	宽带上网网络连接显示总是连接受限怎么办？
78	电脑右下角显示 网络连接受限，怎么弄啊？
78	为什么电脑网络总是受限
79	智能门锁品牌，哪几个品牌靠谱
79	国内知名智能门锁十大品牌哪家个好
79	智能门锁哪家好？
79	智能锁哪个品牌好？
79	智能门锁哪家牌子比较好
79	家庭智能门锁什么牌子好
80	华为手环只能和华为手机匹配吗
80	请问小米手环支持华为手机吗？
80	手环没有华为手机可以用吗
80	小米手环 能和华为手机连接吗
80	华为荣耀手环能与其他手机配吗
81	空气净化器过滤网怎么更换和清洗呢？
81	空气净化器过滤网可以洗了再用吗？
81	空气净化器滤网可以用水洗吗
81	空气净化器过滤网怎么清洗
81	空气净化器滤芯脏了清洗后能用吗？
81	空气净化器如何清洗
82	用牙贴有害吗
82	牙贴会伤害牙齿吗？
82	美白牙贴对牙齿有伤害吗
82	牙贴次数太勤有危害吗
82	牙贴有什么坏处？
82	美白牙贴是不是对牙齿伤害很大？
83	扫地机器人与吸尘器的区别是什么？
83	买了吸尘器还有必要在买一个扫地机器人吗？
83	是买扫地机器人好还是买手持吸尘器好？
83	扫地机器人和吸尘器哪个好
83	扫地机器人和吸尘器到底哪个好
84	腾讯听听音箱有啥特点?
84	腾讯听听音箱有什么不一样的地方？
84	腾讯听听音箱有什么独特功能？
84	腾讯听听音箱有什么特色？
84	腾讯听听和其他智能音箱有什么区别？
85	健身用keep有用吗
85	用keep软件健身有效吗？
85	keep能代替健身教练吗
85	每天跟着keep上面做健身操可以瘦吗
85	keep健身软件能练马甲线吗
86	那个每年的流行色，是谁定的？
86	每年的流行色是怎么定义的？
86	每个时期的流行色是怎么定出来的
86	谁来规定当年的流行色是什么
87	国画中的印章有什么讲究？
87	国画印章一般内容是什么
87	国画印章在绘画中怎样用
87	在中国画中怎样使用印章？
87	中国画上的印章有什么说法？
88	芭蕾舞起源于哪个国家？
88	芭蕾舞的由来和发展历史？
88	芭蕾舞起源于哪里？
88	芭蕾舞的起源到底是什么？
88	芭蕾的起源是啥啊？
89	b站充电up主能拿几成？
89	b站 up主 有收入吗～
89	b站up主是怎么赚钱的
89	b站的up主 点击能赚钱吗
89	b站上出名的主播有工资么
89	B站上给up主投币对up主有什么好处
90	尤克里里好学吗？
90	尤克里里无基础，速成一首弹唱需要多长时间
90	尤克里里自学需要多久
90	怎样快速学成尤克里里
90	尤克里里容易上手吗，好学吗
91	唐朝发型怎么梳
91	唐朝的发式怎样盘
91	唐代发型怎么梳 怎样才能梳出好看简单的发型
91	唐朝女子的发型一般有哪些？
91	唐朝女人的发型是怎么梳的?
92	无限流小说是什么意思？
92	什么是无限流小说啊？
92	无限流是什么
92	什么类型的小说是无限流类型
93	为什么新闻上说不能拍穿越剧啦？
93	为什么禁拍穿越剧？
93	广电为什么禁穿越剧
93	穿越剧禁播了吗？为什么啊？
93	为什么禁止拍穿越剧呢
94	大学自习室占座的很多怎么办？
94	为什么有人会去自习室占座而不学习？
94	如何看待自习室占座行为
94	自习室应不应该占座？
94	如何改善大学自习室占座的现状？
95	保湿面膜什么牌子的好
95	保湿补水面膜用哪种好？
95	哪种纯补水面膜效果好
95	补水保湿面膜哪种好
95	补水面膜哪款好？
95	请问最近的保湿面膜哪种好？
96	安卓手机一直充电对手机好么
96	手机经常充电正确吗?
96	手机经常充电对手机有影响吗？
96	手机充电一直充不满，是怎么回事？
96	手机一直显示充电状态怎么办
97	科目二好过么？？
97	科目二考试过不去怎么办？
97	科目二最难的是什么？
97	科目二考试注意什么
97	考驾校科目二都学什么，都应该注意什么
98	精油如何使用
98	精油的正确使用方法是什么啊？
98	精油可以长期使用吗？
98	精油怎么用？
98	精油有什么作用
99	适合20岁左右女孩子的服装品牌？
99	什么牌子的衣服适合二十岁左右女生？
99	有啥比较适合二十岁左右年轻人的服装大牌
99	什么女装品牌适合26-27岁穿啊？
99	现在最流行的女装20岁左右的牌子是什么？
100	雅诗兰黛眼霜小棕瓶有热的感觉是假的吗
100	雅思兰黛小棕瓶涂上脸后有灼热感是过敏吗
100	为什么雅诗兰黛日霜用完脸烧得慌
100	用雅诗兰黛的小棕瓶皮肤红发烫是怎么回事
100	我使用雅诗兰黛眼霜时，为什么眼睛周围会感觉热热的？
101	去迪士尼需要注意什么
101	去香港迪士尼要注意什么
101	去香港迪士尼有什么要注意的
101	香港迪士尼旅游有什么注意事项
101	带小孩去香港迪士尼乐园怎么玩？要注意什么事情
102	经常长跑的人,如何保护膝盖
102	长跑时怎么保护好膝盖？
102	跑步 怎么不伤害膝盖
102	长期跑步如何保护膝盖？
102	如何做到跑步不伤膝盖
102	经常跑步，如何保护膝关节？
103	滑板中常说的玩降速是什么意思啊？
103	长板玩速降的时候如何控制速度？
103	滑板什么叫速降
103	怎样玩滑板速降不会被摔死？
104	儿童运动鞋十大品牌 是什么
104	儿童运动鞋什么牌子好
104	儿童跑步鞋什么牌子好
104	什么牌子的儿童运动鞋舒服？
104	儿童应该选择什么样的运动鞋？
105	北京周边滑雪场哪个好
105	北京周边滑雪场所哪家好
105	北京滑雪场哪家好玩儿
105	北京有哪些好的滑雪场地推荐
105	北京哪里滑雪场好玩吗
106	古筝长时间不用如何保养？
106	如何保养古筝？
106	古筝要怎样保养才是最好的
106	古筝保养有哪些要注意的呢？
106	古筝长时间不弹会不会坏？那要怎么保养？
106	古筝保养是用干布擦好还是湿布擦好?
107	有人说手指短不适合学钢琴，有道理吗？
107	手指短真的不能弹钢琴吗？
107	手太小，手指太短，弹钢琴制约很大，怎么办？
107	手指短的人真的不适合弹钢琴吗?
107	手指短的是不是就不适合弹钢琴了？
108	印度与中国比哪个国家更穷
108	印度这种穷国为什么那么有钱？
108	为什么印度总是说中国非常穷
108	为什么说中国比印度穷
108	印度为什么觉得中国穷
109	心理学中的解离是什么意思
109	解离症属于精神病还是心理病
109	解离症怎么办
109	什么叫解离
109	解离性同一性障碍是什么意思？
110	涂上口红之后怎么喝水吃东西呢？
110	怎么喝水不掉口红？
110	口红怎么才能不轻易掉,有时一喝水,吃饭.就掉了
110	嘴上有口红喝水怎么办？
110	怎么喝水不喝到口红？
111	上班族经常坐在办公室，要怎么瘦腿
111	怎样在办公室内瘦腿？
111	天天坐在办公室里怎么瘦腿
111	天天坐办公室 想瘦腿 要怎么做
111	经常久坐办公室如何瘦腿
111	办公室白领应该如何瘦腿？
111	办公室如何坐着瘦大腿和小腹？
112	糖尿病人可不可以吃蜂蜜?
112	糖尿病人是否可以吃蜂蜜?
112	糖尿病能不能吃蜂蜜？
112	糖尿病人能喝蜂蜜吗？
112	糖尿病的患者能喝蜂蜜吗
113	猫砂是土砂好还是木砂好？
113	什么猫砂好
113	用什么猫砂不粘底
113	如何挑选合适的猫砂？
113	豆腐猫砂好还是松木的猫砂好？
114	女生穿马丁靴怎么搭配裤子和衣服呢？
114	马丁靴女生怎么搭配
114	马丁靴如何搭配上衣
114	女马丁靴如何搭配
114	女生应该怎么搭配马丁靴
115	螺蛳粉为什么是臭的
115	螺狮粉的臭味为什么那么持久？
115	螺蛳粉为何这么臭？
115	螺蛳粉太臭了怎么去味
115	螺蛳粉的味道怎么去除
116	国内手机怎么上ins？
116	在中国怎样才可以上ins
116	现在怎么用ins
116	大陆怎样能上ins？
116	现在上不了ins了，怎么才能上啊
117	郑爽的性格是什么样的
117	真实的郑爽是一个什么样性格的人
117	如何评价郑爽的性格？
117	郑爽为什么性格不太好
118	怎么在小红书开店？
118	我自己可以在小红书卖东西嘛
118	小红书怎么开店怎么做
118	小红书开店要多少钱啊，企业入驻需要哪些资料呢？
118	我想在小红书上卖美妆可以吗？需要什么条件？
119	今天冲动了，和领导吵架了怎么办？
119	与单位领导吵架后怎么处理?
119	我老是跟领导吵架怎么办
119	我和老板吵架了,怎么办？
119	跟领导吵架了，以后的日子应该不好过，我该怎么办？
119	和领导吵架了，我该不该辞职
120	猫狗养在一起需要注意什么？
120	猫和狗可以同时养吗
